year,proceeding_link,paper_link,title,authors,abstract
1997,https://papers.nips.cc/paper_files/paper/1997,https://papers.nips.cc/paper_files/paper/1997/hash/a60937eba57758ed45b6d3e91e8659f3-Abstract.html,A Hippocampal Model of Recognition Memory,"Randall C. O'Reilly, Kenneth A. Norman, James L. McClelland","A  rich  body  of data  exists  showing that  recollection of specific  infor(cid:173) mation makes an important contribution to  recognition memory,  which  is distinct from the contribution of familiarity, and is not adequately cap(cid:173) tured by existing unitary memory models. Furthennore, neuropsycholog(cid:173) ical evidence indicates that recollection is sub served by the hippocampus.  We  present a  model,  based  largely  on  known features  of hippocampal  anatomy and physiology, that accounts for the following key character(cid:173) istics of recollection:  1) false recollection is rare (i.e., participants rarely  claim to recollect having studied nonstudied items), and 2) increasing in(cid:173) terference leads to less recollection but apparently does not compromise  the quality of recollection (i.e., the extent to which recollected infonna(cid:173) tion veridically reflects events that occurred at study)."
1997,https://papers.nips.cc/paper_files/paper/1997,https://papers.nips.cc/paper_files/paper/1997/hash/a8f8f60264024dca151f164729b76c0b-Abstract.html,Wavelet Models for Video Time-Series,"Sheng Ma, Chuanyi Ji","In this work, we tackle the problem of time-series modeling of video  traffic.  Different from the existing methods which model the time(cid:173) series  in the time domain, we  model the wavelet  coefficients  in the  wavelet  domain.  The strength  of the wavelet  model includes  (1)  a  unified  approach to model both the long-range and the short-range  dependence  in the video traffic simultaneously, (2)  a  computation(cid:173) ally efficient  method on  developing the model and generating high  quality video traffic,  and (3) feasibility of performance analysis us(cid:173) ing the model."
1997,https://papers.nips.cc/paper_files/paper/1997,https://papers.nips.cc/paper_files/paper/1997/hash/a9be4c2a4041cadbf9d61ae16dd1389e-Abstract.html,Multi-time Models for Temporally Abstract Planning,"Doina Precup, Richard S. Sutton","Planning 
Doina Precup, Richard S. Sutton 
University of Massachusetts 
Amherst, MA 01003 
{dprecuplrich}@cs.umass.edu"
1997,https://papers.nips.cc/paper_files/paper/1997,https://papers.nips.cc/paper_files/paper/1997/hash/ac796a52db3f16bbdb6557d3d89d1c5a-Abstract.html,Linear Concepts and Hidden Variables: An Empirical Study,"Adam J. Grove, Dan Roth","Some learning techniques for classification tasks work indirectly, by first trying  to fit a full probabilistic model to the observed data.  Whether this is a good idea  or not depends on the robustness with respect to deviations from  the postulated  model.  We  study this question experimentally in a restricted, yet non-trivial and  interesting case:  we consider a conditionally independent attribute (CIA) model  which  postulates  a  single  binary-valued hidden variable z  on  which all other  attributes (i.e., the target and the observables) depend. In this model, finding the  most likely value of anyone variable (given known values for the others) reduces  to testing a linear function of the observed values. 
We  learn  CIA  with  two  techniques:  the  standard  EM  algorithm,  and  a  new  algorithm we develop based on covariances.  We  compare these, in a controlled  fashion, against an algorithm (a version of Winnow) that attempts to find a good  linear classifier directly.  Our conclusions help delimit the fragility  of using the  CIA model for classification: once the data departs from this model, performance  quickly degrades and drops below that of the directly-learned linear classifier."
1997,https://papers.nips.cc/paper_files/paper/1997,https://papers.nips.cc/paper_files/paper/1997/hash/ad3019b856147c17e82a5bead782d2a8-Abstract.html,Comparison of Human and Machine Word Recognition,"Markus Schenkel, Cyril Latimer, Marwan A. Jabri","We  present  a  study  which  is  concerned with  word  recognition  rates  for  heavily  degraded  documents.  We  compare  human  with  machine  read(cid:173) ing capabilities in a series of experiments, which  explores the interaction  of word/non-word recognition, word frequency  and legality of non-words  with  degradation level.  We  also study the influence  of character segmen(cid:173) tation, and compare human performance with that of our artificial neural  network model for reading.  We found that the proposed computer model  uses  word  context  as  efficiently  as  humans,  but performs  slightly  worse  on the pure character recognition task."
1997,https://papers.nips.cc/paper_files/paper/1997,https://papers.nips.cc/paper_files/paper/1997/hash/ad71c82b22f4f65b9398f76d8be4c615-Abstract.html,Characterizing Neurons in the Primary Auditory Cortex of the Awake Primate Using Reverse Correlation,"R. Christopher DeCharms, Michael Merzenich","While  the  understanding of the  functional  role  of different  classes  of neurons in the awake primary visual cortex has been extensively  studied since the time of Hubel and Wiesel (Hubel and Wiesel, 1962),  our  understanding  of the  feature  selectivity  and  functional  role  of  neurons in  the primary  auditory  cortex  is  much farther  from  com(cid:173) plete.  Moving bars have long been recognized as an optimal stimulus  for  many visual cortical neurons,  and this finding  has recently been  confirmed  and extended in detail using reverse correlation methods  (Jones and Palmer,  1987;  Reid  and Alonso,  1995; Reid  et al.,  1991;  llingach et al.,  1997).  In this study, we recorded from neurons in the  primary auditory cortex of the awake  primate,  and used  a  novel  re(cid:173) verse correlation technique to compute receptive fields  (or preferred  stimuli), encompassing both multiple frequency components and on(cid:173) going time.  These spectrotemporal receptive fields  make clear that  neurons in the primary auditory cortex, as in the primary visual cor(cid:173) tex, typically show considerable structure in their feature processing  properties, often including multiple excitatory and inhibitory regions  in their receptive fields.  These neurons can be sensitive to stimulus  edges in frequency  composition or in time,  and sensitive to stimulus  transitions  such as  changes in  frequency.  These  neurons  also  show  strong responses and selectivity to continuous frequency  modulated  stimuli analogous to visual drifting gratings."
1997,https://papers.nips.cc/paper_files/paper/1997,https://papers.nips.cc/paper_files/paper/1997/hash/af4732711661056eadbf798ba191272a-Abstract.html,Phase Transitions and the Perceptual Organization of Video Sequences,Yair Weiss,"Estimating  motion  in  scenes  containing  multiple  moving  objects  remains  a  difficult  problem  in  computer  vision.  A  promising  ap(cid:173) proach  to this  problem  involves  using  mixture  models,  where  the  motion of each object is a component in the mixture.  However, ex(cid:173) isting methods  typically  require specifying in advance the number  of components  in  the  mixture,  i.e.  the  number  of objects  in  the  scene. 
Here  we  show  that  the  number  of objects can  be  estimated auto(cid:173) matically in a maximum likelihood framework, given an assumption  about the level of noise in the video sequence.  We derive analytical  results  showing  the  number  of models  which  maximize  the  likeli(cid:173) hood for a given noise level in a given sequence.  We illustrate these  results on a real video sequence, showing how the phase transitions  correspond to different  perceptual organizations of the scene. 
• 
Figure  la depicts  a  scene  where motion  estimation is  difficult  for  many  computer  vision  systems.  A  semi-transparent  surface  partially  occludes  a  second  surface,  and  the  camera is  translating  horizontally.  Figure  1 b  shows  a  slice  through  the  horizontal  component  of  the  motion  generated  by  the  camera  - points  that  are  closer  to  the  camera move  faster  than  those  further  away.  In  practice,  the  local  motion information would be noisy as shown in figure lc and this imposes conflicting  demands on a  motion analysis system - reliable estimates require pooling together  many measurements while avoiding mixing together measurements derived from the  two different  surfaces. 
Phase Transitions and the Perceptual Organization of Video Sequences 
851 
. , .. . ,. ""...."
1997,https://papers.nips.cc/paper_files/paper/1997,https://papers.nips.cc/paper_files/paper/1997/hash/afe434653a898da20044041262b3ac74-Abstract.html,Regression with Input-dependent Noise: A Gaussian Process Treatment,"Paul W. Goldberg, Christopher K. I. Williams, Christopher M. Bishop","Gaussian processes  provide natural non-parametric prior distribu(cid:173) tions over regression functions.  In this paper we consider regression  problems where there is  noise  on  the output,  and  the variance  of  the  noise  depends  on  the  inputs.  If we  assume  that  the  noise  is  a  smooth  function  of the  inputs,  then  it  is  natural  to  model  the  noise variance using a second Gaussian process,  in addition to the  Gaussian process governing the noise-free output  value.  We  show  that prior uncertainty about the parameters controlling both pro(cid:173) cesses  can  be  handled  and  that  the  posterior  distribution  of  the  noise  rate can  be  sampled from  using  Markov  chain Monte  Carlo  methods.  Our results on a synthetic data set give a posterior noise  variance that well-approximates the true variance. 
1  Background and Motivation 
A very  natural approach to regression problems is  to place a  prior on  the kinds  of  function  that  we  expect,  and  then  after  observing the  data to obtain  a  posterior.  The prior can be obtained by placing prior distributions on the weights in a neural 
494 
P.  W  Goldberg,  C. K. L Williams and C.  M.  Bishop 
network, although we would argue that it is perhaps more natural to place priors di(cid:173) rectly over functions.  One tractable way of doing this is to create a  Gaussian process  prior.  This has the advantage that predictions can be made from the posterior using  only  matrix multiplication for  fixed  hyperparameters  and  a  global  noise level.  In  contrast, for  neural networks  (with fixed  hyperparameters and a global noise level)  it is necessary to use approximations or Markov chain Monte Carlo (MCMC)  meth(cid:173) ods.  Rasmussen  (1996)  has  demonstrated that predictions obtained with Gaussian  processes are as  good as or better than other state-of-the art predictors. 
In  much of the work on regression problems in the statistical and neural networks  literatures, it is assumed that there is  a global noise level, independent of the input  vector  x.  The book  by  Bishop  (1995)  and the  papers  by  Bishop  (1994),  MacKay  (1995)  and  Bishop  and  Qazaz  (1997)  have  examined  the  case  of input-dependent  (Such  models  are  said  to  noise  for  parametric  models  such  as  neural  networks.  heteroscedastic in the statistics literature.)  In this paper we  develop the treatment  of an input-dependent noise model for  Gaussian process regression, where the noise  is assumed to be Gaussian but its variance depends on x.  As  the noise level is non(cid:173) negative we  place a  Gaussian process  prior on  the  log  noise  level.  Thus  there  are  two Gaussian processes involved in making predictions:  the usual Gaussian process  for  predicting the function  values  (the y-process),  and another one  (the  z-process)  for  predicting the log  noise  level.  Below  we  present  a  Markov chain Monte Carlo  method for  carrying out inference with this model and demonstrate its performance  on a  test  problem. 
1.1  Gaussian processes 
A stochastic process  is  a  collection of random variables  {Y(x)lx  E  X} indexed by  a  set  X.  Often  X  will  be  a  space  such  as  'R,d  for  some dimension  d,  although  it  could be more general.  The stochastic process is specified by giving the probability  distribution  for  every  finite  subset  of  variables  Y(Xl), ... , Y(Xk)  in  a  consistent  manner.  A  Gaussian  process  is  a  stochastic  process  which  can  be fully  specified  by  its  mean  function  J.L(x)  =  E[Y(x)]  and  its  covariance  function  Cp(x,x')  =  E[(Y(x)-J.L(x»)(Y(x')-J.L(x'»]; any finite set of points will have a joint multivariate  Gaussian distribution.  Below we  consider Gaussian processes which have J.L(x)  ==  O.  This  assumes  that  any  known  offset  or  trend  in  the  data  has  been. removed.  A  non-zero  I' (x )  is  easily  incorporated  into  the  framework  at  the  expense  of extra  notational complexity. 
A  covariance  junction  is  used  to  define  a  Gaussian  process;  it  is  a  parametrised  function  from  pairs  of  x-values  to  their  covariance.  The  form  of  the  covariance  function that we  shall use for  the prior over functions  is  given by 
Cy(x(i),xU» =vyexp (-~ tWYl(x~i) _x~j»2) + Jy 8(i,j)"
1997,https://papers.nips.cc/paper_files/paper/1997,https://papers.nips.cc/paper_files/paper/1997/hash/b069b3415151fa7217e870017374de7c-Abstract.html,A Generic Approach for Identification of Event Related Brain Potentials via a Competitive Neural Network Structure,"Daniel H. Lange, Hava T. Siegelmann, Hillel Pratt, Gideon F. Inbar","We  present  a  novel generic  approach to the problem of Event  Related  Potential identification and classification,  based on a competitive N eu(cid:173) ral  Net  architecture.  The network  weights  converge  to the embedded  signal  patterns,  resulting  in  the  formation  of a  matched  filter  bank.  The network performance is analyzed via a simulation study, exploring  identification  robustness  under  low  SNR conditions  and compared  to  the  expected  performance  from  an information  theoretic  perspective.  The  classifier  is  applied  to  real  event-related  potential  data  recorded  during  a  classic  odd-ball  type  paradigm;  for  the  first  time,  within(cid:173) session  variable  signal  patterns  are  automatically  identified,  dismiss(cid:173) ing  the  strong  and  limiting  requirement  of  a-priori  stimulus-related  selective  grouping of the recorded  data. 
902 
D.  H.  Lange, H.  T.  Siegelmann, H.  Pratt and G.  F.  Inbar"
1997,https://papers.nips.cc/paper_files/paper/1997,https://papers.nips.cc/paper_files/paper/1997/hash/b197ffdef2ddc3308584dce7afa3661b-Abstract.html,On the Infeasibility of Training Neural Networks with Small Squared Errors,Van H. Vu,"We demonstrate that the problem of training neural networks with  small (average)  squared error is computationally intractable.  Con(cid:173) sider a data set of M  points (Xi, Yi),  i  =  1,2, ... , M, where  Xi  are  input  vectors  from  Rd,  Yi  are  real  outputs  (Yi  E  R).  For  a  net- work 10  in some class F of neural networks,  (11M) L~l (fO(Xi)(cid:173) Yi)2)1/2 - inlfEF(l/ M) ""2:f!1 (f(Xi) - YJ2)1/2  is the (avarage) rel(cid:173) ative error  occurs  when one  tries to fit  the  data set  by 10.  We will  prove for several classes F  of neural networks that achieving a  rela(cid:173) tive  error  smaller than some fixed  positive threshold  (independent  from  the size  of the data set)  is  NP-hard."
1997,https://papers.nips.cc/paper_files/paper/1997,https://papers.nips.cc/paper_files/paper/1997/hash/b265ce60fe4c5384e622b09eb829b8df-Abstract.html,Structure Driven Image Database Retrieval,"Jeremy S. De Bonet, Paul A. Viola","A  new  algorithm  is  presented  which  approximates  the  perceived  visual  similarity  between  images.  The images  are  initially  trans(cid:173) formed  into  a  feature  space  which  captures  visual  structure,  tex(cid:173) ture  and  color  using  a  tree  of filters.  Similarity  is  the  inverse  of  the distance in this  perceptual feature  space.  Using this  algorithm  we  have constructed an image database system which can perform  example based retrieval on large image databases.  Using carefully  constructed target sets, which limit variation to only a single visual  characteristic, retrieval rates are quantitatively compared to those  of standard methods."
1997,https://papers.nips.cc/paper_files/paper/1997,https://papers.nips.cc/paper_files/paper/1997/hash/b7087c1f4f89e63af8d46f3b20271153-Abstract.html,Bayesian Robustification for Audio Visual Fusion,"Javier R. Movellan, Paul Mineiro","We discuss the problem of catastrophic fusion in multimodal recog(cid:173) nition  systems.  This  problem  arises  in systems  that  need  to  fuse  different  channels in  non-stationary environments.  Practice shows  that when  recognition modules  within each modality are tested in  contexts inconsistent with their assumptions, their influence on the  fused  product tends to increase,  with catastrophic results.  We  ex(cid:173) plore  a  principled  solution  to  this  problem  based  upon  Bayesian  ideas  of  competitive  models  and  inference  robustification:  each  sensory channel is  provided  with  simple  white-noise context mod(cid:173) els,  and  the  perceptual  hypothesis  and  context  are  jointly  esti(cid:173) mated.  Consequently, context deviations are interpreted as changes  in white noise contamination strength, automatically adjusting the  influence of the module.  The approach is  tested on  a fixed  lexicon  automatic audiovisual speech  recognition problem  with very good  results."
1997,https://papers.nips.cc/paper_files/paper/1997,https://papers.nips.cc/paper_files/paper/1997/hash/b8c27b7a1c450ffdacb31483454e0b54-Abstract.html,A Neural Network Model of Naive Preference and Filial Imprinting in the Domestic Chick,Lucy E. Hadden,"Filial imprinting in domestic chicks is of interest in psychology, biology,  and  computational  modeling because  it  exemplifies  simple,  rapid,  in(cid:173) nately programmed learning which is biased toward learning about some  objects.  Hom et  al.  have  recently discovered a  naive visual preference  for  heads  and  necks  which develops  over the  course  of the  first  three  days of life.  The  neurological basis of this predisposition is  almost en(cid:173) tirely unknown;  that  of imprinting-related learning  is  fairly  clear.  This  project is  the  first  model  of the  predisposition consistent with  what  is  known about learning in imprinting. The model develops the predisposi(cid:173) tion appropriately, learns to ""approach"" a training object, and replicates  one  interaction between the  two  processes.  Future work  will  replicate  more interactions between imprinting  and the  predisposition in chicks,  and analyze why the system works."
1997,https://papers.nips.cc/paper_files/paper/1997,https://papers.nips.cc/paper_files/paper/1997/hash/bad5f33780c42f2588878a9d07405083-Abstract.html,Shared Context Probabilistic Transducers,"Yoshua Bengio, Samy Bengio, Jean-Franc Isabelle, Yoram Singer","Recently,  a model for  supervised learning of probabilistic transduc(cid:173) ers  represented  by suffix trees  was  introduced.  However,  this  algo(cid:173) rithm tends  to build very  large  trees,  requiring very large amounts  of computer memory.  In this paper, we  propose  anew, more com(cid:173) pact, transducer model in which one shares the parameters of distri(cid:173) butions  associated  to  contexts  yielding similar conditional output  distributions .  We  illustrate the  advantages  of the  proposed  algo(cid:173) rithm  with  comparative  experiments  on  inducing  a  noun  phrase  recogmzer."
1997,https://papers.nips.cc/paper_files/paper/1997,https://papers.nips.cc/paper_files/paper/1997/hash/bcc0d400288793e8bdcd7c19a8ac0c2b-Abstract.html,Learning to Schedule Straight-Line Code,"J. Eliot B. Moss, Paul E. Utgoff, John Cavazos, Doina Precup, Darko Stefanovic, Carla E. Brodley, David Scheeff","Program execution speed on modem computers is sensitive,  by  a factor  of  two or more, to the order in which instructions are presented to the proces(cid:173) sor.  To realize potential execution efficiency,  an optimizing compiler must  employ  a heuristic  algorithm  for  instruction  scheduling.  Such  algorithms  are painstakingly hand-crafted, which is expensive and time-consuming. We  show how to cast the instruction scheduling problem as  a learning task, ob(cid:173) taining the  heuristic  scheduling  algorithm  automatically.  Our focus  is  the  narrower problem of scheduling straight-line code (also called basic blocks  of instructions).  Our empirical results  show that just a few features  are ad(cid:173) equate for quite good performance at this  task for a real modem processor,  and that  any  of several  supervised  learning  methods  perform nearly  opti(cid:173) mally with respect to the features used."
1997,https://papers.nips.cc/paper_files/paper/1997,https://papers.nips.cc/paper_files/paper/1997/hash/c0826819636026dd1f3674774f06c51d-Abstract.html,Approximating Posterior Distributions in Belief Networks Using Mixtures,"Christopher M. Bishop, Neil D. Lawrence, Tommi Jaakkola, Michael I. Jordan","Exact inference in densely connected Bayesian networks is computation(cid:173) ally intractable, and so there is considerable interest in developing effec(cid:173) tive approximation schemes. One approach which has been adopted is to  bound the log likelihood using a mean-field approximating distribution.  While this leads to a tractable algorithm, the mean field distribution is as(cid:173) sumed to be factorial and hence unimodal.  In this paper we demonstrate  the feasibility of using a richer class of approximating distributions based  on mixtures of mean field distributions.  We derive an efficient algorithm  for updating the mixture parameters and apply it to the problem of learn(cid:173) ing  in  sigmoid  belief networks.  Our results  demonstrate  a  systematic  improvement over  simple  mean  field  theory  as  the  number of mixture  components is increased."
1997,https://papers.nips.cc/paper_files/paper/1997,https://papers.nips.cc/paper_files/paper/1997/hash/c26820b8a4c1b3c2aa868d6d57e14a79-Abstract.html,The Canonical Distortion Measure in Feature Space and 1-NN Classification,"Jonathan Baxter, Peter L. Bartlett","We  prove  that  the  Canonical  Distortion Measure  (CDM)  [2,  3]  is  the  optimal distance measure to use for  I  nearest-neighbour (l-NN) classifi(cid:173) cation, and show that it reduces to squared Euclidean distance in feature  space  for function classes that can be expressed  as  linear combinations  of a  fixed  set  of features.  PAC-like  bounds  are  given  on the  sample(cid:173) complexity  required to  learn the CDM.  An experiment  is presented  in  which  a  neural network CDM was  learnt for a Japanese  OCR environ(cid:173) ment and then used to do  I-NN classification."
1997,https://papers.nips.cc/paper_files/paper/1997,https://papers.nips.cc/paper_files/paper/1997/hash/c5cc17e395d3049b03e0f1ccebb02b4d-Abstract.html,A Non-Parametric Multi-Scale Statistical Model for Natural Images,"Jeremy S. De Bonet, Paul A. Viola","The  observed  distribution  of natural  images  is  far  from  uniform.  On  the  contrary,  real  images  have  complex  and  important  struc(cid:173) ture  that  can  be  exploited  for  image  processing,  recognition  and  analysis.  There have been many proposed approaches to the prin(cid:173) cipled  statistical modeling of images, but each has been  limited  in  either  the complexity  of the  models  or  the  complexity  of the  im(cid:173) ages.  We present a non-parametric multi-scale statistical model for  images  that can be  used for  recognition,  image  de-noising,  and  in  a  ""generative mode""  to synthesize high  quality textures."
1997,https://papers.nips.cc/paper_files/paper/1997,https://papers.nips.cc/paper_files/paper/1997/hash/c73dfe6c630edb4c1692db67c510f65c-Abstract.html,A Solution for Missing Data in Recurrent Neural Networks with an Application to Blood Glucose Prediction,"Volker Tresp, Thomas Briegel","We  consider neural  network models for stochastic nonlinear dynamical  systems  where measurements  of the  variable of interest are only avail(cid:173) able at irregular intervals i.e.  most realizations are missing.  Difficulties  arise  since the solutions for  prediction and maximum  likelihood learn(cid:173) ing with missing data lead  to  complex integrals, which even  for simple  cases  cannot  be  solved  analytically.  In  this  paper  we  propose  a  spe(cid:173) cific  combination of a nonlinear recurrent  neural  predictive model  and  a  linear error model  which  leads  to  tractable prediction and  maximum  likelihood adaptation rules.  In particular,  the  recurrent  neural  network  can be trained using the real-time recurrent learning rule and  the linear  error model  can be trained by an EM  adaptation rule,  implemented us(cid:173) ing forward-backward Kalman filter equations. The model is applied to  predict the glucose/insulin metabolism of a diabetic patient where blood  glucose measurements  are  only available a few  times a day  at  irregular  intervals.  The new model shows considerable improvement with respect  to both recurrent neural networks trained with teacher forcing or in a free  running mode and various linear models."
