year,proceeding_link,paper_link,title,authors,abstract
1997,https://papers.nips.cc/paper_files/paper/1997,https://papers.nips.cc/paper_files/paper/1997/hash/7895fc13088ee37f511913bac71fa66f-Abstract.html,Hybrid Reinforcement Learning and Its Application to Biped Robot Control,"Satoshi Yamada, Akira Watanabe, Michio Nakashima","A  learning  system  composed of linear  control  modules,  reinforce(cid:173) ment  learning modules  and selection  modules  (a hybrid  reinforce(cid:173) ment learning system) is proposed for the fast learning of real-world  control  problems.  The  selection  modules  choose  one  appropriate  control module  dependent  on the  state.  This  hybrid learning sys(cid:173) tem was applied to the control of a stilt-type biped robot.  It learned  the control on a sloped floor  more quickly than the usual reinforce(cid:173) ment  learning  because  it  did  not  need  to learn  the  control  on  a  flat  floor,  where  the  linear  control  module  can  control the  robot.  When it was trained by a  2-step learning (during the first  learning  step, the selection module was trained by a training procedure con(cid:173) trolled  only  by  the  linear  controller),  it  learned  the  control  more  quickly.  The average  number of trials  (about  50)  is  so small  that  the learning system is  applicable to real robot control."
1997,https://papers.nips.cc/paper_files/paper/1997,https://papers.nips.cc/paper_files/paper/1997/hash/78b9cab19959e4af8ff46156ee460c74-Abstract.html,Synaptic Transmission: An Information-Theoretic Perspective,"Amit Manwani, Christof Koch","Here  we  analyze  synaptic  transmission  from  an  infonnation-theoretic  perspective. We derive c1osed-fonn expressions for the lower-bounds on  the capacity of a simple model of a cortical synapse under two explicit  coding paradigms.  Under the ""signal estimation"" paradigm, we assume  the signal to be encoded in the mean firing rate of a Poisson neuron.  The  perfonnance of an optimal linear estimator of the  signal  then  provides  a lower bound on the  capacity for signal estimation.  Under the  ""signal  detection"" paradigm, the presence or absence of the signal has to be de(cid:173) tected.  Perfonnance of the optimal spike detector allows us to compute  a lower bound on the capacity for signal detection.  We  find  that single  synapses (for empirically measured parameter values) transmit infonna(cid:173) tion poorly but  significant  improvement can be  achieved  with  a  small  amount of redundancy."
1997,https://papers.nips.cc/paper_files/paper/1997,https://papers.nips.cc/paper_files/paper/1997/hash/792c7b5aae4a79e78aaeda80516ae2ac-Abstract.html,Just One View: Invariances in Inferotemporal Cell Tuning,"Maximilian Riesenhuber, Tomaso Poggio","In  macaque  inferotemporal cortex  (IT),  neurons have  been found to re(cid:173) spond  selectively to complex  shapes  while  showing broad  tuning (""in(cid:173) variance"")  with  respect  to stimulus transformations such as  translation  and  scale  changes  and  a  limited  tuning to rotation  in  depth.  Training  monkeys with novel,  paperclip-like objects, Logothetis et al. 9  could in(cid:173) vestigate whether these invariance properties are due to experience with  exhaustively many transformed instances of an object or if there are mech(cid:173) anisms that allow the cells to show response invariance also to previously  unseen instances of that object.  They found object-selective cells in an(cid:173) terior IT which exhibited limited invariance  to various transformations  after training with single object views.  While previous models accounted  for  the tuning of the  cells  for  rotations  in  depth and  for  their selectiv(cid:173) ity  to a  specific  object relative to a population of distractor objects,14,1  the model described here attempts to explain in a  biologically plausible  way  the additional properties of translation  and  size  invariance.  Using  the  same  stimuli  as  in  the  experiment,  we  find  that model  IT neurons  exhibit invariance properties which closely parallel those of real neurons.  Simulations show that the model  is capable of unsupervised learning of  view-tuned neurons. 
We thank Peter Dayan, Marcus Dill, Shimon Edelman, Nikos Logothetis, Jonathan Mumick and 
Randy O'Reilly for useful discussions and comments. 
216"
1997,https://papers.nips.cc/paper_files/paper/1997,https://papers.nips.cc/paper_files/paper/1997/hash/79a49b3e3762632813f9e35f4ba53d6c-Abstract.html,Agnostic Classification of Markovian Sequences,"Ran El-Yaniv, Shai Fine, Naftali Tishby","Classification of finite sequences without explicit knowledge of their  statistical nature is  a  fundamental  problem  with  many  important  applications.  We  propose  a  new  information  theoretic  approach  to this  problem which is  based on the following  ingredients:  (i)  se(cid:173) quences are similar when they are likely to be generated by the same  source;  (ii) cross entropies can be estimated via ""universal compres(cid:173) sion"";  (iii)  Markovian  sequences  can  be  asymptotically-optimally  merged.  With these ingredients we  design a  method for  the classification of  discrete sequences whenever they can be compressed.  We introduce  the method and illustrate its application for hierarchical clustering  of languages and for  estimating similarities of protein sequences. 
1"
1997,https://papers.nips.cc/paper_files/paper/1997,https://papers.nips.cc/paper_files/paper/1997/hash/7a674153c63cff1ad7f0e261c369ab2c-Abstract.html,Visual Navigation in a Robot Using Zig-Zag Behavior,M. Anthony Lewis,"We implement a model of obstacle avoidance in flying insects on a small,  monocular robot. The result is a system that is capable of rapid navigation  through a dense obstacle field. The key to the system is the use of zigzag  behavior to articulate the body during movement. It is shown that this  behavior  compensates for a parallax blind spot surrounding the focus of expansion nor(cid:173) mally found in systems without parallax behavior. The system models the coop(cid:173) eration of several behaviors: halteres-ocular response (similar to VOR),  optomotor response, and the parallax field computation and mapping to motor  system. The resulting system is neurally plausible, very simple, and should be  easily hosted on a VLSI hardware."
1997,https://papers.nips.cc/paper_files/paper/1997,https://papers.nips.cc/paper_files/paper/1997/hash/7b5b23f4aadf9513306bcd59afb6e4c9-Abstract.html,Generalized Prioritized Sweeping,"David Andre, Nir Friedman, Ronald Parr","Prioritized sweeping  is  a  model-based  reinforcement learning  method  that  attempts  to  focus  an  agent's  limited  computational  resources  to  achieve a good estimate of the value of environment states.  To choose ef(cid:173) fectively where to spend a costly planning step, classic prioritized sweep(cid:173) ing  uses  a simple  heuristic  to  focus  computation on  the  states  that are  likely to have the largest errors.  In this paper, we  introduce generalized  prioritized sweeping, a principled method for generating such estimates  in a representation-specific manner.  This allows us to extend prioritized  sweeping beyond an explicit, state-based representation to deal with com(cid:173) pact representations that are necessary for dealing with large state spaces.  We  apply  this  method  for  generalized  model  approximators  (such  as  Bayesian networks), and describe preliminary experiments that compare  our approach with classical prioritized sweeping."
1997,https://papers.nips.cc/paper_files/paper/1997,https://papers.nips.cc/paper_files/paper/1997/hash/7d6044e95a16761171b130dcb476a43e-Abstract.html,Multiresolution Tangent Distance for Affine-invariant Classification,"Nuno Vasconcelos, Andrew Lippman","The ability  to  rely  on similarity  metrics  invariant to  image transforma(cid:173) tions is  an important issue for image classification tasks such as face or  character recognition. We analyze an invariant metric that has performed  well for the latter - the tangent distance - and study its limitations when  applied to regular images, showing that the most significant among these  (convergence to local minima) can be drastically reduced by computing  the distance in a multiresolution setting. This leads to the multi resolution  tangent distance,  which exhibits  significantly  higher invariance  to  im(cid:173) age transformations, and can be easily combined with robust estimation  procedures."
1997,https://papers.nips.cc/paper_files/paper/1997,https://papers.nips.cc/paper_files/paper/1997/hash/7f53f8c6c730af6aeb52e66eb74d8507-Abstract.html,Effects of Spike Timing Underlying Binocular Integration and Rivalry in a Neural Model of Early Visual Cortex,Erik D. Lumer,"In normal vision, the inputs from the two eyes are inte(cid:173) grated into a single percept. When dissimilar images are  presented to the two eyes, however, perceptual integra(cid:173) tion gives way to alternation between monocular inputs,  a phenomenon called binocular rivalry. Although recent  evidence indicates that binocular rivalry involves a mod(cid:173) ulation of neuronal responses in extrastriate cortex, the  basic mechanisms responsible for differential processing of  con:6.icting and congruent stimuli remain unclear. Using a  neural network that models the mammalian early visual  system, I demonstrate here that the desynchronized fir(cid:173) ing of cortical-like neurons that first receive inputs from  the two eyes results in rivalrous activity patterns at later  stages in the visual pathway. By contrast, synchronization  of firing among these cells prevents such competition. The  temporal coordination of cortical activity and its effects  on neural competition emerge naturally from the network  connectivity and from its dynamics. These results suggest  that input-related differences in relative spike timing at  an early stage of visual processing may give rise to the  phenomena both of perceptual integration and rivalry in  binocular vision."
1997,https://papers.nips.cc/paper_files/paper/1997,https://papers.nips.cc/paper_files/paper/1997/hash/81ca0262c82e712e50c580c032d99b60-Abstract.html,Detection of First and Second Order Motion,"Alexander Grunewald, Heiko Neumann","A  model  of  motion  detection  is  presented.  The  model  contains  three stages.  The first  stage is  unoriented and is  selective for  con(cid:173) trast  polarities.  The  next  two  stages  work  in  parallel.  A  phase  insensitive stage pools across  different  contrast polarities through  a  spatiotemporal filter  and thus can detect  first  and second order  motion.  A phase sensitive stage keeps  contrast polarities separate,  each of which is  filtered  through  a  spatiotemporal filter,  and thus  only first order motion can be detected.  Differential phase sensitiv(cid:173) ity can therefore account for  the detection of first  and second order  motion.  Phase insensitive detectors correspond to cortical complex  cells,  and phase sensitive detectors to simple  cells."
1997,https://papers.nips.cc/paper_files/paper/1997,https://papers.nips.cc/paper_files/paper/1997/hash/82965d4ed8150294d4330ace00821d77-Abstract.html,A Framework for Multiple-Instance Learning,"Oded Maron, Tomás Lozano-Pérez","Multiple-instance learning is a variation on supervised learning, where the  task  is  to  learn  a  concept  given  positive and  negative  bags  of instances.  Each  bag  may  contain many  instances,  but a  bag  is  labeled  positive even  if only one of the instances in it falls  within the concept.  A  bag is  labeled  negative  only  if all  the  instances  in  it are  negative.  We  describe  a  new  general  framework,  called Diverse  Density,  for  solving multiple-instance  learning problems.  We  apply this framework to learn a simple description  of a person from a series of images (bags) containing that person, to a stock  selection problem, and to the drug activity prediction problem."
1997,https://papers.nips.cc/paper_files/paper/1997,https://papers.nips.cc/paper_files/paper/1997/hash/83adc9225e4deb67d7ce42d58fe5157c-Abstract.html,Monotonic Networks,Joseph Sill,"Monotonicity  is  a  constraint which  arises  in many application do(cid:173) mains.  We present  a  machine learning model,  the monotonic net(cid:173) work, for which monotonicity can be enforced exactly, i.e., by virtue  offunctional form .  A straightforward method for implementing and  training  a  monotonic  network  is  described.  Monotonic  networks  are  proven  to  be  universal  approximators of continuous,  differen(cid:173) tiable  monotonic functions.  We  apply  monotonic  networks  to  a  real-world  task  in  corporate  bond  rating  prediction  and  compare  them to other approaches."
1997,https://papers.nips.cc/paper_files/paper/1997,https://papers.nips.cc/paper_files/paper/1997/hash/83cdcec08fbf90370fcf53bdd56604ff-Abstract.html,Relative Loss Bounds for Multidimensional Regression Problems,"Jyrki Kivinen, Manfred K. Warmuth","We  study  on-line generalized  linear  regression  with  multidimensional  outputs, i.e.,  neural  networks with multiple output nodes  but no  hidden  nodes.  We  allow  at the  final  layer transfer functions  such  as  the soft(cid:173) max function that need to consider the linear activations to all the output  neurons.  We use distance functions of a certain kind in two completely  independent roles in deriving and analyzing on-line learning algorithms  for  such tasks.  We use one distance function to define a matching loss  function for the (possibly multidimensional) transfer function, which al(cid:173) lows us to generalize earlier results from one-dimensional to multidimen(cid:173) sional outputs. We use another distance function as a tool for measuring  progress made by the on-line updates.  This shows how previously stud(cid:173) ied  algorithms  such  as  gradient  descent  and  exponentiated gradient fit  into a common  framework.  We  evaluate  the  performance of the  algo(cid:173) rithms  using relative  loss  bounds  that  compare  the  loss  of the  on-line  algoritm to the best off-line predictor from the relevant model class, thus  completely eliminating probabilistic assumptions about the data."
1997,https://papers.nips.cc/paper_files/paper/1997,https://papers.nips.cc/paper_files/paper/1997/hash/856fc81623da2150ba2210ba1b51d241-Abstract.html,Gradients for Retinotectal Mapping,Geoffrey J. Goodhill,"The initial activity-independent formation of a  topographic map  in  the retinotectal  system has  long been thought  to  rely  on  the  matching of molecular cues expressed in gradients in the retina  and  the  tectum.  However,  direct experimental evidence for  the  existence of such gradients has only emerged since 1995. The new  data has provoked the discussion of a new set of models in the ex(cid:173) perimentalliterature. Here, the capabilities of these models are an(cid:173) alyzed, and the gradient shapes they predict in vivo are derived."
1997,https://papers.nips.cc/paper_files/paper/1997,https://papers.nips.cc/paper_files/paper/1997/hash/86109d400f0ed29e840b47ed72777c84-Abstract.html,Multi-modular Associative Memory,"Nir Levy, David Horn, Eytan Ruppin","Motivated  by  the findings  of modular structure  in  the association  cortex,  we study a multi-modular model of associative memory that  can successfully  store  memory patterns  with different  levels  of ac(cid:173) tivity.  We show that the segregation of synaptic conductances into  intra-modular linear and inter-modular nonlinear ones considerably  enhances  the  network's  memory retrieval  performance.  Compared  with  the conventional, single-module associative  memory network,  the multi-modular network has two main advantages:  It is  less sus(cid:173) ceptible to damage to columnar input, and its response is consistent  with the cognitive data pertaining to category specific impairment."
1997,https://papers.nips.cc/paper_files/paper/1997,https://papers.nips.cc/paper_files/paper/1997/hash/861dc9bd7f4e7dd3cccd534d0ae2a2e9-Abstract.html,Analysis of Drifting Dynamics with Neural Network Hidden Markov Models,"Jens Kohlmorgen, Klaus-Robert Müller, Klaus Pawelzik","We  present  a  method  for  the  analysis  of  nonstationary  time  se(cid:173) ries  with multiple  operating modes.  In particular, it is possible to  detect and to model  both a  switching  of the dynamics  and a  less  abrupt,  time  consuming  drift  from  one  mode  to another.  This  is  achieved in two steps.  First, an unsupervised training method pro(cid:173) vides  prediction experts for  the inherent dynamical modes.  Then,  the trained experts are used in a hidden Markov model that allows  to  model  drifts.  An  application  to  physiological  wake/sleep  data  demonstrates that analysis and modeling of real-world time series  can be improved when the drift paradigm is  taken into account."
1997,https://papers.nips.cc/paper_files/paper/1997,https://papers.nips.cc/paper_files/paper/1997/hash/86e8f7ab32cfd12577bc2619bc635690-Abstract.html,The Observer-Observation Dilemma in Neuro-Forecasting,"Hans-Georg Zimmermann, Ralph Neuneier","We  explain how the training data can  be separated  into  clean informa(cid:173) tion and unexplainable noise.  Analogous to the data, the neural network  is  separated  into  a  time invariant  structure used  for  forecasting,  and  a  noisy part.  We propose a unified theory connecting the optimization al(cid:173) gorithms for cleaning and learning together with algorithms that control  the data noise and the parameter noise.  The combined algorithm allows  a data-driven local control of the liability of the network parameters and  therefore an  improvement  in generalization.  The approach is proven to  be very useful at the task of forecasting the German bond market. 
1  Introduction: The Observer-Observation Dilemma 
Human beings believe that they are able to solve a psychological version of the Observer(cid:173) Observation Dilemma. On the one hand, they use their observations to constitute an under(cid:173) standing of the laws of the world, on the other hand, they use this understanding to evaluate  the  correctness  of the incoming pieces  of information.  Of course,  as  everybody knows,  human beings are not free from making mistakes in this psychological dilemma.  We  en(cid:173) counter a similar situation when we try to build a mathematical model using data.  Learning  relationships from the data is only one part of the model building process.  Overrating this  part often leads to the phenomenon of overfitting in many applications (especially in eco(cid:173) nomic forecasting).  In practice, evaluation of the data is often done by external knowledge,  i. e.  by optimizing the model under constraints of smoothness and regularization [7].  If we  assume, that our model summerizes the best knowledge of the system to be identified, why  should we not use the model itself to evaluate the correctness of the data?  One approach to  do this is called Clearning [11].  In this paper, we present a unified approach of the interac(cid:173) tion between the data and a neural network (see also [8]).  It includes a new symmetric view  on the optimization algorithms, here learning and cleaning, and their control by parameter  and data noise. 
The Observer-Observation Dilemma in Neuro-Forecasting 
993"
1997,https://papers.nips.cc/paper_files/paper/1997,https://papers.nips.cc/paper_files/paper/1997/hash/8b0d268963dd0cfb808aac48a549829f-Abstract.html,A Model of Early Visual Processing,"Laurent Itti, Jochen Braun, Dale K. Lee, Christof Koch","We  propose  a  model for  early  visual  processing  in  primates.  The  model consists  of a  population of linear spatial filters  which  inter(cid:173) act  through non-linear excitatory  and inhibitory pooling.  Statisti(cid:173) cal estimation theory  is  then used  to derive human psychophysical  thresholds from the responses of the entire population of units.  The  model is  able  to reproduce  human thresholds for  contrast  and ori(cid:173) entation discrimination tasks,  and to predict contrast thresholds in  the presence  of masks of varying orientation and spatial frequency."
1997,https://papers.nips.cc/paper_files/paper/1997,https://papers.nips.cc/paper_files/paper/1997/hash/8b0dc65f996f98fd178a9defd0efa077-Abstract.html,A Simple and Fast Neural Network Approach to Stereovision,Rolf D. Henkel,"A  neural  network  approach  to  stereovision  is  presented  based  on  aliasing effects of simple disparity estimators and a fast coherence(cid:173) detection  scheme.  Within  a  single network structure, a  dense  dis(cid:173) parity  map  with  an  associated  validation  map  and,  additionally,  the  fused  cyclopean  view  of the scene  are  available.  The network  operations  are  based  on  simple,  biological  plausible  circuitry;  the  algorithm is  fully  parallel and non-iterative."
1997,https://papers.nips.cc/paper_files/paper/1997,https://papers.nips.cc/paper_files/paper/1997/hash/8d3369c4c086f236fabf61d614a32818-Abstract.html,Data-Dependent Structural Risk Minimization for Perceptron Decision Trees,"John Shawe-Taylor, Nello Cristianini","A novel neural network model of pre-attention processing in visual(cid:173) search  tasks  is  presented.  Using displays of line orientations taken  from  Wolfe's experiments  [1992], we  study the  hypothesis  that the  distinction  between  parallel  versus  serial  processes  arises  from  the  availability of global information in  the internal representations  of  the  visual  scene.  The  model  operates  in  two  phases.  First,  the  visual  displays  are  compressed  via  principal-component-analysis.  Second,  the compressed data is processed by a target detector mod(cid:173) ule in order to identify the existence of a  target in the display.  Our  main  finding  is  that  targets  in  displays  which  were  found  exper(cid:173) imentally  to  be  processed  in  parallel can  be  detected  by  the  sys(cid:173) tem,  while  targets  in  experimentally-serial  displays  cannot .  This  fundamental  difference  is  explained  via  variance  analysis  of  the  compressed representations,  providing a  numerical criterion distin(cid:173) guishing parallel from serial displays.  Our model yields a  mapping  of response-time slopes that is similar to Duncan and Humphreys's  ""search  surface""  [1989],  providing  an  explicit  formulation  of their  intuitive  notion  of feature  similarity.  It presents  a  neural  realiza(cid:173) tion of the  processing that may underlie the classical metaphorical  explanations of visual search. 
On Parallel versus Serial Processing: A  Computational Study a/Visual Search"
1997,https://papers.nips.cc/paper_files/paper/1997,https://papers.nips.cc/paper_files/paper/1997/hash/8d9a0adb7c204239c9635426f35c9522-Abstract.html,Using Expectation to Guide Processing: A Study of Three Real-World Applications,Shumeet Baluja,"In many real world tasks, only a small fraction of the available inputs are important  at any  particular time. This paper presents a method for ascertaining the relevance  of inputs  by  exploiting  temporal  coherence  and  predictability.  The  method  pro(cid:173) posed in this paper dynamically allocates relevance to inputs by using expectations  of their  future  values.  As  a  model  of the  task  is  learned,  the  model  is  simulta(cid:173) neously extended to create task-specific predictions of the future values of inputs.  Inputs which are either not relevant, and therefore not accounted for in the model,  or those which contain noise, will not be predicted accurately. These inputs can be  de-emphasized, and, in turn, a new, improved, model of the task created. The tech(cid:173) niques  presented  in  this  paper  have  yielded  significant  improvements  for  the  vision-based  autonomous control of a land vehicle,  vision-based hand tracking in  cluttered scenes, and the detection of faults in the etching of semiconductor wafers."
1997,https://papers.nips.cc/paper_files/paper/1997,https://papers.nips.cc/paper_files/paper/1997/hash/8edd72158ccd2a879f79cb2538568fdc-Abstract.html,Features as Sufficient Statistics,"Davi Geiger, Archisman Rudra, Laurance T. Maloney","An image is often represented by a set of detected features.  We get  an enormous compression by representing images in this way.  Fur(cid:173) thermore,  we  get a  representation which  is  little affected by  small  amounts  of  noise  in  the  image.  However,  features  are  typically  chosen  in  an  ad  hoc  manner.  tures can be obtained using sufficient statistics.  The idea of sparse  data representation  naturally  arises.  We  treat  the  I-dimensional  and 2-dimensional signal reconstruction problem to make our ideas  concrete. 
\Ve  show  how  a  good  set  of fea(cid:173)"
1997,https://papers.nips.cc/paper_files/paper/1997,https://papers.nips.cc/paper_files/paper/1997/hash/8fb21ee7a2207526da55a679f0332de2-Abstract.html,Factorizing Multivariate Function Classes,Juan K. Lin,"The mathematical framework for  factorizing equivalence classes of  multivariate  functions  is  formulated  in  this  paper.  Independent  component analysis is  shown to be a  special case of this decompo(cid:173) sition.  Using  only  the  local  geometric  structure  of a  class  repre(cid:173) sentative,  we  derive an analytic solution for  the factorization.  We  demonstrate the factorization solution with numerical experiments  and present a  preliminary tie to decorrelation."
