year,proceeding_link,paper_link,title,authors,abstract
1997,https://papers.nips.cc/paper_files/paper/1997,https://papers.nips.cc/paper_files/paper/1997/hash/46771d1f432b42343f56f791422a4991-Abstract.html,Use of a Multi-Layer Perceptron to Predict Malignancy in Ovarian Tumors,"Herman Verrelst, Yves Moreau, Joos Vandewalle, Dirk Timmerman","This paper is concerned with the problem of Reinforcement Learn(cid:173) ing  (RL)  for  continuous  state  space  and  time  stocha.stic  control  problems.  We  state the Harnilton-Jacobi-Bellman  equation satis(cid:173) fied  by  the value  function  and use  a  Finite-Difference method for  designing a  convergent  approximation scheme.  Then we  propose a  RL  algorithm  based on this  scheme  and prove  its  convergence  to  the optimal solution. 
1 
Introduction to RL in the continuous, stochastic case 
The objective of RL is to find -thanks to a reinforcement signal- an optimal strategy  for  solving  a  dynamical  control problem.  Here we  sudy  the continuous  time,  con(cid:173) tinuous state-space stochastic case, which covers a wide variety of control problems  including target,  viability,  optimization  problems  (see  [FS93],  [KP95])}or  which  a  formalism  is  the following.  The evolution of the  current  state  x(t)  E  0  (the  state(cid:173) space, with 0  open subset of IRd ), depends on the control u(t)  E  U (compact subset)  by a  stochastic differential equation,  called the  state  dynamics: 
dx =  f(x(t), u(t))dt + a(x(t), u(t))dw 
(1)  where f  is the local drift  and a .dw  (with w  a brownian motion of dimension rand  (j  a d x r-matrix) the stochastic part (which appears for  several reasons such as lake  of precision,  noisy influence,  random fluctuations)  of the diffusion process.  For  initial state x  and control u(t),  (1)  leads  to  an infinity of possible  traj~tories  x(t).  For  some  trajectory  x(t)  (see  figure  I).,  let  T  be its  exit  time  from  0  (with  the convention  that  if x(t)  always  stays  in  0, then  T  =  00).  Then,  we  define  the  functional  J  of initial state x and control u(.) as the expectation for  all trajectories  of the discounted cumulative reinforcement  : 
J(x; u(.))  =  Ex,u( .) {loT '/r(x(t), u(t))dt +,,{ R(X(T))}"
1997,https://papers.nips.cc/paper_files/paper/1997,https://papers.nips.cc/paper_files/paper/1997/hash/489d0396e6826eb0c1e611d82ca8b215-Abstract.html,Learning Nonlinear Overcomplete Representations for Efficient Coding,"Michael S. Lewicki, Terrence J. Sejnowski","We  derive a  learning algorithm for  inferring an overcomplete basis  by  viewing  it  as  probabilistic  model  of the  observed data.  Over(cid:173) complete  bases  allow  for  better  approximation  of the  underlying  statistical density.  Using a Laplacian prior on the basis coefficients  removes  redundancy  and  leads  to  representations that  are  sparse  and  are  a  nonlinear  function  of the data.  This  can  be  viewed  as  a  generalization of the technique  of independent  component  anal(cid:173) ysis  and  provides  a  method  for  blind  source  separation  of  fewer  mixtures  than  sources.  We  demonstrate  the  utility  of  overcom(cid:173) plete  representations  on  natural  speech  and  show  that  compared  to the traditional Fourier basis the inferred representations poten(cid:173) tially have much greater coding efficiency. 
A  traditional  way  to represent  real-values  signals is  with  Fourier or wavelet  bases.  A  disadvantage  of these  bases,  however,  is  that  they  are  not  specialized  for  any  particular  dataset.  Principal  component  analysis  (PCA)  provides  one  means  for  finding  an  basis  that is  adapted for  a  dataset,  but the basis  vectors are  restricted  to  be  orthogonal.  An  extension  of  PCA  called  independent  component  analysis  (Jutten  and  Herault,  1991;  Comon  et  al.,  1991;  Bell  and  Sejnowski,  1995)  allows  the learning of non-orthogonal bases.  All  of these bases  are complete in  the sense  that they span the input space,  but they are limited in terms of how  well  they can  approximate the dataset's statistical density. 
Representations that are overcomplete,  i. e. more basis vectors than input variables,  can provide a better representation, because the basis vectors can be specialized for 
Learning Nonlinear Overcomplete Representations for Efficient Coding 
557 
a  larger variety of features  present  in  the entire  ensemble  of data.  A  criticism  of  overcomplete representations is that they are redundant, i.e.  a given data point may  have  many  possible  representations,  but  this  redundancy  is  removed  by  the  prior  probability of the basis coefficients which specifies the probability  of the alternative  representations. 
Most  of the  overcomplete  bases  used  in  the  literature are  fixed  in  the  sense  that  they  are not adapted to the structure in  the data.  Recently  Olshausen  and  Field  (1996)  presented an algorithm that allows an overcomplete basis to be learned. This  algorithm relied on an approximation to the desired probabilistic objective that had  several  drawbacks, including tendency to breakdown in the case of low  noise levels  and when learning bases with higher degrees of overcompleteness.  In this paper, we  present an improved approximation to the desired probabilistic objective and show  that this leads to a simple  and robust algorithm for  learning optimal overcomplete  bases. 
1 
Inferring the representation 
The data,  X 1 :L '  are modeled with an overcomplete linear basis plus additive noise:"
1997,https://papers.nips.cc/paper_files/paper/1997,https://papers.nips.cc/paper_files/paper/1997/hash/4dcae38ee11d3a6606cc6cd636a3628b-Abstract.html,Receptive Field Formation in Natural Scene Environments: Comparison of Single Cell Learning Rules,"Brian S. Blais, Nathan Intrator, Harel Z. Shouval, Leon N. Cooper","We  study  several  statistically and  biologically  motivated learning  rules  using  the same visual  environment,  one  made up  of natural  scenes,  and the same single cell  neuronal architecture.  This allows  us  to  concentrate  on  the  feature  extraction  and  neuronal  coding  properties  of these rules.  Included  in  these rules  are kurtosis  and  skewness  maximization,  the  quadratic form  of the  BCM  learning  rule,  and  single  cell  ICA.  Using  a  structure  removal  method,  we  demonstrate  that  receptive  fields  developed  using  these  rules  de(cid:173) pend  on  a  small  portion  of  the  distribution.  We  find  that  the  quadratic form  of the BCM rule behaves in  a manner similar to a  kurtosis maximization rule when the distribution contains kurtotic  directions,  although the  BCM  modification equations  are compu(cid:173) tationally simpler. 
424 
B.  S.  Blais, N.  Intrator, H.  Shouval and L  N.  Cooper"
1997,https://papers.nips.cc/paper_files/paper/1997,https://papers.nips.cc/paper_files/paper/1997/hash/4e0d67e54ad6626e957d15b08ae128a6-Abstract.html,Reinforcement Learning for Call Admission Control and Routing in Integrated Service Networks,"Peter Marbach, Oliver Mihatsch, Miriam Schulte, John N. Tsitsiklis","We provide a model of the standard watermaze task, and of a more  challenging task involving novel platform locations, in which rats  exhibit one-trial learning after a few days of training.  The model  uses hippocampal place cells to support reinforcement learning,  and also,  in an integrated manner,  to build  and use  allocentric  coordinates."
1997,https://papers.nips.cc/paper_files/paper/1997,https://papers.nips.cc/paper_files/paper/1997/hash/4e8412ad48562e3c9934f45c3e144d48-Abstract.html,The Error Coding and Substitution PaCTs,"Gareth James, Trevor Hastie",A new class of plug in  classification techniques have recently been de(cid:173) veloped in the statistics and machine learning literature.  A plug in clas(cid:173) sification  technique (PaCT) is  a  method that takes  a standard classifier  (such  as  LDA or TREES)  and plugs  it into an  algorithm to produce a  new classifier.  The  standard classifier  is  known as  the Plug  in  Classi(cid:173) fier  (PiC). These methods often produce large improvements over using  a single classifier.  In this paper we investigate one of these methods and  give some motivation for its success.
1997,https://papers.nips.cc/paper_files/paper/1997,https://papers.nips.cc/paper_files/paper/1997/hash/4edaa105d5f53590338791951e38c3ad-Abstract.html,Modeling Complex Cells in an Awake Macaque during Natural Image Viewing,"William E. Vinje, Jack L. Gallant","We  model  the  responses  of cells  in  visual  area  VI  during  natural  vision.  Our model consists  of a  classical energy  mechanism whose  output is divided by nonclassical gain control and texture  contrast  mechanisms.  We  apply  this  model  to  review  movies,  a  stimulus  sequence  that replicates  the stimulation a  cell  receives  during free  viewing  of natural  images.  Data  were  collected  from  three  cells  using five  different  review movies, and the model was fit  separately  to  the data from  each  movie.  For  the  energy  mechanism alone  we  find  modest  but  significant  correlations  (rE  =  0.41,  0.43,  0.59,  0.35)  between  model  and  data.  These  correlations  are  improved  somewhat when we  allow for suppressive surround effects  (rE+G  =  0.42,  0.56,  0.60,  0.37).  In  one  case  the  inclusion  of a  delayed  suppressive  surround dramatically improves the  fit  to the  data by  modifying the  time course  of the model's response."
1997,https://papers.nips.cc/paper_files/paper/1997,https://papers.nips.cc/paper_files/paper/1997/hash/4f87658ef0de194413056248a00ce009-Abstract.html,Generalization in Decision Trees and DNF: Does Size Matter?,"Mostefa Golea, Peter L. Bartlett, Wee Sun Lee, Llew Mason","Recent  theoretical  results  for  pattern  classification  with  thresh(cid:173) olded real-valued  functions  (such  as  support  vector  machines,  sig(cid:173) moid  networks,  and  boosting)  give  bounds  on  misclassification  probability  that  do  not  depend  on  the size  of the  classifier,  and  hence can be considerably smaller than the bounds that follow from  the VC  theory.  In  this  paper,  we  show  that  these  techniques  can  be  more  widely  applied,  by  representing  other  boolean  functions  as  two-layer neural  networks  (thresholded convex  combinations of  boolean functions).  For example, we show that with high probabil(cid:173) ity any decision tree of depth no more than d that is consistent with  m training examples has misclassification probability no more than  o ( (~ (Neff VCdim(U)  log2 m log d)) 1/2),  where U is  the  class  of  node  decision  functions,  and  Neff  ::;  N  can  be  thought  of as  the  effective  number of leaves  (it  becomes small  as  the distribution on  the  leaves  induced  by  the  training  data gets  far  from  uniform).  This  bound  is  qualitatively different  from  the VC  bound  and  can  be considerably smaller.  We use the same technique to give similar results for DNF formulae. 
•  Author to whom correspondence should be addressed 
260 
M.  Golea,  P Bartlett,  W.  S. Lee and L  Mason"
1997,https://papers.nips.cc/paper_files/paper/1997,https://papers.nips.cc/paper_files/paper/1997/hash/4fa7c62536118cc404dec4a0ca88d4f6-Abstract.html,Local Dimensionality Reduction,"Stefan Schaal, Sethu Vijayakumar, Christopher G. Atkeson","If globally high dimensional data has locally only low dimensional distribu(cid:173) tions,  it is  advantageous to perform a local dimensionality reduction before  further processing the data.  In this paper we examine several techniques for  local  dimensionality reduction  in the  context of locally weighted linear re(cid:173) gression.  As possible candidates, we derive local versions of factor analysis  regression, principle component regression, principle component regression  on joint distributions, and partial least squares regression. After outlining the  statistical bases of these  methods,  we perform Monte Carlo  simulations to  evaluate  their  robustness  with  respect  to  violations  of their  statistical  as(cid:173) sumptions.  One  surprising  outcome  is  that  locally  weighted  partial  least  squares  regression offers the best average results,  thus outperforming even  factor analysis, the theoretically most appealing of our candidate techniques."
1997,https://papers.nips.cc/paper_files/paper/1997,https://papers.nips.cc/paper_files/paper/1997/hash/512c5cad6c37edb98ae91c8a76c3a291-Abstract.html,A Mathematical Model of Axon Guidance by Diffusible Factors,Geoffrey J. Goodhill,"In the developing nervous system, gradients of target-derived dif(cid:173) fusible factors play an important role in guiding axons to  appro(cid:173) priate targets.  In this paper, the shape that such a gradient might  have is calculated as a function of distance from the target and the  time since  the start of factor production.  Using estimates  of the  relevant parameter values  from  the  experimental literature,  the  spatiotemporal domain in which a growth cone could detect such  a  gradient is derived.  For large times, a  value for the maximum  guidance range  of about 1 mm is  obtained.  This value fits  well  with experimental data.  For smaller times,  the  analysis predicts  that guidance over longer ranges may be possible. This prediction  remains to be tested."
1997,https://papers.nips.cc/paper_files/paper/1997,https://papers.nips.cc/paper_files/paper/1997/hash/536a76f94cf7535158f66cfbd4b113b6-Abstract.html,Asymptotic Theory for Regularization: One-Dimensional Linear Case,Petri Koistinen,"The  generalization  ability  of a  neural  network  can  sometimes  be  improved dramatically by regularization.  To  analyze the improve(cid:173) ment  one  needs  more  refined  results  than  the  asymptotic  distri(cid:173) bution  of  the  weight  vector.  Here  we  study  the  simple  case  of  one-dimensional  linear  regression  under  quadratic  regularization,  i.e.,  ridge  regression.  We  study  the  random  design,  misspecified  case, where we derive expansions for  the optimal regularization pa(cid:173) rameter and  the ensuing improvement.  It is  possible  to construct  examples  where it  is  best to use no regularization."
1997,https://papers.nips.cc/paper_files/paper/1997,https://papers.nips.cc/paper_files/paper/1997/hash/54072f485cdb7897ebbcaf7525139561-Abstract.html,Instabilities in Eye Movement Control: A Model of Periodic Alternating Nystagmus,"Ernst R. Dow, Thomas J. Anastasio","Nystagmus is  a pattern of eye movement characterized by  smooth rota(cid:173) tions  of the eye in one direction  and  rapid  rotations  in  the opposite di(cid:173) rection that reset eye position.  Periodic alternating nystagmus (PAN) is  a form  of uncontrollable  nystagmus  that  has  been  described  as  an  un(cid:173) stable but amplitude-limited oscillation.  PAN has been observed previ(cid:173) ously  only  in  subjects  with  vestibulo-cerebellar damage.  We describe  results in  which  PAN can be produced  in normal  subjects by prolonged  rotation in darkness.  We propose a new model  in  which the neural  cir(cid:173) cuits  that control eye movement are  inherently  unstable,  but  this  insta(cid:173) bility  is  kept  in  check  under  normal  circumstances  by  the  cerebellum.  Circumstances  which  alter  this  cerebellar  restraint,  such  as  vestibulo(cid:173) cerebellar damage or plasticity  due  to  rotation  in  darkness,  can  lead  to  PAN."
1997,https://papers.nips.cc/paper_files/paper/1997,https://papers.nips.cc/paper_files/paper/1997/hash/540ae6b0f6ac6e155062f3dd4f0b2b01-Abstract.html,Neural Basis of Object-Centered Representations,"Sophie Denève, Alexandre Pouget","We  present  a  neural  model  that  can  perform eye movements to a  particular side of an object regardless of the position and orienta(cid:173) tion  of the  object  in  space,  a  generalization  of a  task  which  has  been recently used by Olson and Gettner [4]  to investigate the neu(cid:173) ral structure of object-centered representations.  Our model uses an  intermediate representation in which units have oculocentric recep(cid:173) tive fields- just like collicular neurons- whose gain is modulated by  the side of the object to which the movement is directed, as  well as  the orientation of the object.  We show that these gain modulations  are consistent with Olson and Gettner's single cell recordings in the  supplementary eye  field.  This  demonstrates  that it  is  possible to  perform  an  object-centered  task  without  a  representation  involv(cid:173) ing an object-centered map, viz.,  without neurons whose receptive  fields are defined in object-centered coordinates.  We also show that  the same approach can account for  object-centered neglect, a  situ(cid:173) ation in which  patients with a  right parietal lesion neglect the left  side of objects regardless of the orientation of the objects. 
Several authors have argued that tasks such as object recognition [3]  and manipula(cid:173) tion  [4]  are easier to perform if the object is  represented in object-centered coordi(cid:173) nates, a representation in which the subparts of the object are encoded with respect  to a frame of reference centered on the object.  Compelling evidence for the existence  of such  representations in  the  cortex comes  from  experiments  on  hemineglect- a  neurological syndrome resulting from  unilateral lesions  of the parietal cortex such  that a  right lesion, for  example, leads  patients to ignore stimuli located on the left  side of their egocentric space.  Recently,  Driver et al.  (1994)  showed that the deficit  can  also  be  object-centered.  Hence,  hemineglect  patients can  detect  a  gap  in  the  upper edge of a triangle when this gap is associated with the right side of the object 
Neural Basis of Object-Centered Representations"
1997,https://papers.nips.cc/paper_files/paper/1997,https://papers.nips.cc/paper_files/paper/1997/hash/56352739f59643540a3a6e16985f62c7-Abstract.html,Modelling Seasonality and Trends in Daily Rainfall Data,Peter M. Williams,"This paper presents a new approach to the problem of modelling daily  rainfall using neural networks. We first model the conditional distribu(cid:173) tions of rainfall amounts, in such a way that the model itself determines  the order of the process, and the time-dependent shape and scale of the  conditional distributions. After integrating over particular weather pat(cid:173) terns, we are able to extract seasonal variations and long-term trends."
1997,https://papers.nips.cc/paper_files/paper/1997,https://papers.nips.cc/paper_files/paper/1997/hash/56468d5607a5aaf1604ff5e15593b003-Abstract.html,The Storage Capacity of a Fully-Connected Committee Machine,"Yuansheng Xiong, Chulan Kwon, Jong-Hoon Oh","We study the storage capacity of a fully-connected  committee ma(cid:173) chine  with a  large number  K  of hidden  nodes.  The storage capac(cid:173) ity is obtained by analyzing the geometrical structure of the weight  space  related  to the internal representation .  By examining the as(cid:173) ymptotic behavior of order  parameters in the limit of large K, the  storage capacity Q c  is found to be proportional to ]{ Jln ]{ up to the  leading order.  This  result  satisfies  the  mathematical bound given  by  Mitchison  and  Durbin , whereas  the  replica-symmetric solution  in  a conventional Gardner's  approach  violates this bound."
